{
  "$schema": "https://json-schema.org/draft/2020-12/schema",
  "$id": "https://open-agent-workflow.dev/schemas/v3/provider-descriptor.schema.json",
  "type": "object",
  "additionalProperties": false,
  "required": ["schema_version", "descriptor_version", "id", "display_name", "discovery", "capabilities"],
  "properties": {
    "schema_version": {"const": "oaw.provider-descriptor/v3"},
    "descriptor_version": {"type": "string", "pattern": "^(0|[1-9][0-9]*)\\.(0|[1-9][0-9]*)\\.(0|[1-9][0-9]*)$"},
    "id": {"$ref": "#/$defs/qualified_id"},
    "display_name": {"type": "string", "minLength": 1},
    "discovery": {
      "type": "array",
      "uniqueItems": true,
      "items": {
        "oneOf": [
          {
            "type": "object",
            "additionalProperties": false,
            "required": ["id", "hosts", "surface", "distribution", "kind", "root", "candidate_path", "evidence_path"],
            "properties": {
              "id": {"$ref": "#/$defs/local_id"},
              "hosts": {"$ref": "#/$defs/hosts"},
              "surface": {"$ref": "#/$defs/local_id"},
              "distribution": {"$ref": "#/$defs/local_id"},
              "kind": {"const": "path-exists"},
              "root": {"$ref": "#/$defs/root"},
              "candidate_path": {"$ref": "#/$defs/path"},
              "evidence_path": {"$ref": "#/$defs/path"}
            }
          },
          {
            "type": "object",
            "additionalProperties": false,
            "required": ["id", "hosts", "surface", "distribution", "kind", "root", "prefix", "evidence_path"],
            "properties": {
              "id": {"$ref": "#/$defs/local_id"},
              "hosts": {"$ref": "#/$defs/hosts"},
              "surface": {"$ref": "#/$defs/local_id"},
              "distribution": {"$ref": "#/$defs/local_id"},
              "kind": {"const": "one-level-version-path-exists"},
              "root": {"$ref": "#/$defs/root"},
              "prefix": {"$ref": "#/$defs/path"},
              "evidence_path": {"$ref": "#/$defs/path"}
            }
          }
        ]
      }
    },
    "capabilities": {"type": "array", "uniqueItems": true, "items": {"$ref": "#/$defs/capability"}}
  },
  "$defs": {
    "qualified_id": {"type": "string", "pattern": "^[a-z0-9][a-z0-9.-]*/[a-z0-9][a-z0-9._-]*$"},
    "local_id": {"type": "string", "pattern": "^[a-z0-9][a-z0-9.-]*$"},
    "hosts": {"type": "array", "minItems": 1, "uniqueItems": true, "items": {"$ref": "#/$defs/local_id"}},
    "root": {"enum": ["user-home", "xdg-config-home", "project-root"]},
    "path": {
      "type": "string",
      "allOf": [
        {"pattern": "^[^/\\\\\\x00-\\x1f\\x7f]+(?:/[^/\\\\\\x00-\\x1f\\x7f]+)*$"},
        {"not": {"anyOf": [{"pattern": "(^|/)\\.(/|$)"}, {"pattern": "(^|/)\\.\\.(/|$)"}, {"pattern": "[*?\\[\\]{}()]"}]}}
      ]
    },
    "capability": {
      "type": "object",
      "additionalProperties": false,
      "required": ["id", "input_schema", "outcome_schema", "maximum_effects", "resources", "request_modes", "responsibilities", "supported_topologies", "delegation_allow_list", "host_bindings"],
      "properties": {
        "id": {"$ref": "#/$defs/local_id"},
        "input_schema": {"type": "string", "minLength": 1},
        "outcome_schema": {"type": "string", "minLength": 1},
        "maximum_effects": {"type": "array", "uniqueItems": true, "items": {"enum": ["read-project", "write-project", "run-process", "git-local", "network-read"]}},
        "resources": {"type": "array", "uniqueItems": true, "items": {"enum": ["project", "project-worktree", "git-repository"]}},
        "request_modes": {"type": "array", "minItems": 1, "uniqueItems": true, "items": {"enum": ["BOUNDED", "WORKFLOW"]}},
        "responsibilities": {"type": "array", "uniqueItems": true, "items": {"type": "string", "minLength": 1}},
        "supported_topologies": {"$ref": "#/$defs/topologies"},
        "delegation_allow_list": {"type": "array", "uniqueItems": true, "items": {"type": "string", "minLength": 1}},
        "host_bindings": {"type": "array", "minItems": 1, "uniqueItems": true, "items": {"$ref": "#/$defs/binding"}}
      }
    },
    "binding": {
      "type": "object",
      "additionalProperties": false,
      "required": ["host", "kind", "reference", "topologies"],
      "properties": {
        "host": {"$ref": "#/$defs/local_id"},
        "kind": {"enum": ["skill", "agent", "tool"]},
        "reference": {"type": "string", "minLength": 1},
        "topologies": {"$ref": "#/$defs/topologies"}
      }
    },
    "topologies": {"type": "array", "minItems": 1, "uniqueItems": true, "items": {"enum": ["CURRENT", "SUBAGENT"]}}
  }
}
