{
  "schema_version": "oaw.provider-descriptor/v3",
  "descriptor_version": "3.0.0",
  "id": "oaw/ecc",
  "display_name": "Everything Claude Code",
  "discovery": [
    {"id":"ecc-global-skill","hosts":["codex"],"surface":"codex-user-skills","distribution":"ecc-global","kind":"path-exists","root":"user-home","candidate_path":".agents/skills/everything-claude-code","evidence_path":"SKILL.md"},
    {"id":"ecc-marketplace-plugin","hosts":["claude"],"surface":"claude-marketplace","distribution":"everything-claude-code","kind":"path-exists","root":"user-home","candidate_path":".claude/plugins/marketplaces/everything-claude-code/plugins/ecc","evidence_path":".codex-plugin/plugin.json"},
    {"id":"ecc-marketplace-skill","hosts":["claude"],"surface":"claude-marketplace","distribution":"everything-claude-code","kind":"path-exists","root":"user-home","candidate_path":".claude/plugins/marketplaces/everything-claude-code","evidence_path":".agents/skills/everything-claude-code/SKILL.md"},
    {"id":"ecc-versioned-cache","hosts":["claude"],"surface":"claude-plugin-cache","distribution":"everything-claude-code","kind":"one-level-version-path-exists","root":"user-home","prefix":".claude/plugins/cache/everything-claude-code/ecc","evidence_path":".codex-plugin/plugin.json"}
  ],
  "capabilities": [
    {"id":"planning","input_schema":"oaw.capability-input/v1","outcome_schema":"oaw.capability-outcome/v1","maximum_effects":["read-project","write-project"],"resources":["project-worktree"],"request_modes":["WORKFLOW"],"responsibilities":["requirements","domain-modeling","specification","ticket-decomposition","implementation-planning"],"delegation_allow_list":["architecture"],"host_bindings":[{"host":"codex","kind":"agent","reference":"planner","topologies":["CURRENT","SUBAGENT"]},{"host":"claude","kind":"agent","reference":"planner","topologies":["CURRENT","SUBAGENT"]}],"supported_topologies":["CURRENT","SUBAGENT"]},
    {"id":"architecture","input_schema":"oaw.capability-input/v1","outcome_schema":"oaw.capability-outcome/v1","maximum_effects":["read-project","write-project"],"resources":["project-worktree"],"request_modes":["BOUNDED","WORKFLOW"],"responsibilities":[],"delegation_allow_list":[],"host_bindings":[{"host":"codex","kind":"agent","reference":"architect","topologies":["CURRENT","SUBAGENT"]},{"host":"claude","kind":"agent","reference":"architect","topologies":["CURRENT","SUBAGENT"]}],"supported_topologies":["CURRENT","SUBAGENT"]},
    {"id":"implementation","input_schema":"oaw.capability-input/v1","outcome_schema":"oaw.capability-outcome/v1","maximum_effects":["read-project","write-project","run-process","git-local"],"resources":["project-worktree","git-repository"],"request_modes":["WORKFLOW"],"responsibilities":["workspace","implementation","delegation"],"delegation_allow_list":["tdd","functional-debugging","build-repair","review","verification"],"host_bindings":[{"host":"codex","kind":"agent","reference":"tdd-guide","topologies":["CURRENT","SUBAGENT"]},{"host":"claude","kind":"agent","reference":"tdd-guide","topologies":["CURRENT","SUBAGENT"]}],"supported_topologies":["CURRENT","SUBAGENT"]},
    {"id":"tdd","input_schema":"oaw.capability-input/v1","outcome_schema":"oaw.capability-outcome/v1","maximum_effects":["read-project","write-project","run-process"],"resources":["project-worktree"],"request_modes":["WORKFLOW"],"responsibilities":["tdd"],"delegation_allow_list":[],"host_bindings":[{"host":"codex","kind":"agent","reference":"tdd-guide","topologies":["CURRENT","SUBAGENT"]},{"host":"claude","kind":"agent","reference":"tdd-guide","topologies":["CURRENT","SUBAGENT"]}],"supported_topologies":["CURRENT","SUBAGENT"]},
    {"id":"functional-debugging","input_schema":"oaw.capability-input/v1","outcome_schema":"oaw.capability-outcome/v1","maximum_effects":["read-project","write-project","run-process"],"resources":["project-worktree"],"request_modes":["BOUNDED","WORKFLOW"],"responsibilities":["functional-debugging"],"delegation_allow_list":[],"host_bindings":[{"host":"codex","kind":"agent","reference":"tdd-guide","topologies":["CURRENT","SUBAGENT"]},{"host":"claude","kind":"agent","reference":"tdd-guide","topologies":["CURRENT","SUBAGENT"]}],"supported_topologies":["CURRENT","SUBAGENT"]},
    {"id":"build-repair","input_schema":"oaw.capability-input/v1","outcome_schema":"oaw.capability-outcome/v1","maximum_effects":["read-project","write-project","run-process"],"resources":["project-worktree"],"request_modes":["BOUNDED","WORKFLOW"],"responsibilities":["build-repair","dependency-repair","type-repair"],"delegation_allow_list":[],"host_bindings":[{"host":"codex","kind":"agent","reference":"build-error-resolver","topologies":["CURRENT","SUBAGENT"]},{"host":"claude","kind":"agent","reference":"build-error-resolver","topologies":["CURRENT","SUBAGENT"]}],"supported_topologies":["CURRENT","SUBAGENT"]},
    {"id":"review","input_schema":"oaw.capability-input/v1","outcome_schema":"oaw.capability-outcome/v1","maximum_effects":["read-project"],"resources":["project"],"request_modes":["BOUNDED","WORKFLOW"],"responsibilities":["review"],"delegation_allow_list":["security-review"],"host_bindings":[{"host":"codex","kind":"agent","reference":"code-reviewer","topologies":["CURRENT","SUBAGENT"]},{"host":"claude","kind":"agent","reference":"code-reviewer","topologies":["CURRENT","SUBAGENT"]}],"supported_topologies":["CURRENT","SUBAGENT"]},
    {"id":"remediation","input_schema":"oaw.capability-input/v1","outcome_schema":"oaw.capability-outcome/v1","maximum_effects":["read-project","write-project","run-process"],"resources":["project-worktree"],"request_modes":["WORKFLOW"],"responsibilities":["remediation"],"delegation_allow_list":["tdd","functional-debugging","review"],"host_bindings":[{"host":"codex","kind":"agent","reference":"tdd-guide","topologies":["CURRENT","SUBAGENT"]},{"host":"claude","kind":"agent","reference":"tdd-guide","topologies":["CURRENT","SUBAGENT"]}],"supported_topologies":["CURRENT","SUBAGENT"]},
    {"id":"verification","input_schema":"oaw.capability-input/v1","outcome_schema":"oaw.capability-outcome/v1","maximum_effects":["read-project","run-process"],"resources":["project"],"request_modes":["BOUNDED","WORKFLOW"],"responsibilities":["verification"],"delegation_allow_list":[],"host_bindings":[{"host":"codex","kind":"agent","reference":"e2e-runner","topologies":["CURRENT","SUBAGENT"]},{"host":"claude","kind":"agent","reference":"e2e-runner","topologies":["CURRENT","SUBAGENT"]}],"supported_topologies":["CURRENT","SUBAGENT"]},
    {"id":"completion","input_schema":"oaw.capability-input/v1","outcome_schema":"oaw.capability-outcome/v1","maximum_effects":["read-project","run-process","git-local"],"resources":["git-repository","project-worktree"],"request_modes":["WORKFLOW"],"responsibilities":["completion"],"delegation_allow_list":[],"host_bindings":[{"host":"codex","kind":"agent","reference":"code-reviewer","topologies":["CURRENT","SUBAGENT"]},{"host":"claude","kind":"agent","reference":"code-reviewer","topologies":["CURRENT","SUBAGENT"]}],"supported_topologies":["CURRENT","SUBAGENT"]},
    {"id":"security-review","input_schema":"oaw.capability-input/v1","outcome_schema":"oaw.capability-outcome/v1","maximum_effects":["read-project","network-read"],"resources":["project"],"request_modes":["BOUNDED","WORKFLOW"],"responsibilities":[],"delegation_allow_list":[],"host_bindings":[{"host":"codex","kind":"agent","reference":"security-reviewer","topologies":["CURRENT","SUBAGENT"]},{"host":"claude","kind":"agent","reference":"security-reviewer","topologies":["CURRENT","SUBAGENT"]}],"supported_topologies":["CURRENT","SUBAGENT"]}
  ]
}
